{
  "citation_id": "cit_f0458aa00557a40bd9fe6df367771677",
  "source_system": "web-research",
  "source_id": "https://docs.example.com/guides/retention",
  "revision": "dcefafde849e1c169a27dda1d9478b318e2a6db5cf1decfb9a9d2ef966a2707e",
  "revision_kind": "content_hash",
  "url": "https://docs.example.com/guides/retention",
  "title": "Data retention guide",
  "author": null,
  "retrieved_at": "2026-08-08T11:41:55Z",
  "permission_ref": null
}
