{
  "citation_id": "cit_f31cfa3912430f4aa61a5114e6f8985e",
  "source_system": "github",
  "source_id": "OraclousAI/oraclous-backend:README.md",
  "revision": "9f2a4c81b3d7e5061c8a4f2b6d90e37c15ab8e42",
  "revision_kind": "blob_sha",
  "url": "https://github.com/OraclousAI/oraclous-backend/blob/9f2a4c81b3d7e5061c8a4f2b6d90e37c15ab8e42/README.md",
  "title": "README.md",
  "author": {
    "display_name": "Dana Okoro",
    "source_handle": "danaokoro"
  },
  "retrieved_at": "2026-08-08T09:14:22Z",
  "permission_ref": null
}
