{
  "citation_id": "cit_5486bdda6dad3e38bb0f71d7fcdba3b3",
  "source_system": "upload",
  "source_id": "b7f1c0de-4a2e-4d3f-9c61-0f8e5a2b6d14",
  "revision": "11d128f90c81607f526563bff9a1d3de66fd15fa7579ea03502e537a57a54530",
  "revision_kind": "content_hash",
  "url": null,
  "title": "quarterly-plan.md",
  "author": null,
  "retrieved_at": "2026-08-08T12:30:00Z",
  "permission_ref": null
}
